{
  "schemaVersion": 1,
  "repo": {
    "name": "spring-petclinic",
    "summary": "Server-rendered Spring Boot sample: owners, their pets and vet visits, edited through Thymeleaf forms. One JPA aggregate (Owner \u2192 Pet \u2192 Visit) is loaded eagerly and saved as a whole; vets are read-only and cached.",
    "url": "https://github.com/spring-projects/spring-petclinic",
    "blobUrl": "https://github.com/spring-projects/spring-petclinic/blob/{commit}/{path}#L{line}"
  },
  "generated": {
    "at": "2026-10-29T17:46:05Z",
    "commit": "500158f73241",
    "branch": "main",
    "by": "cartograph-survey (toolkit smoke test)"
  },
  "readingPath": [
    {
      "title": "The Owner aggregate",
      "target": "snippet:owner-aggregate",
      "note": "Pets and visits are cascaded from Owner; every write goes through OwnerRepository.save."
    },
    {
      "title": "Booking a visit end to end",
      "target": "flow:book-visit",
      "note": "Shows the @ModelAttribute pre-load pattern every owner/pet form uses."
    },
    {
      "title": "Visits must be in the future",
      "target": "snippet:visit-date-rule",
      "note": "The only business rule enforced in a controller."
    },
    {
      "title": "How data and caching are set up",
      "target": "component:platform",
      "note": "Profile-selected database and the single 'vets' cache."
    }
  ],
  "layers": [
    {
      "id": "entry",
      "name": "Web",
      "description": "Controllers and Thymeleaf views"
    },
    {
      "id": "domain",
      "name": "Domain",
      "description": "Entities and repositories"
    },
    {
      "id": "platform",
      "name": "Platform",
      "description": "Boot, caching, web config"
    },
    {
      "id": "data",
      "name": "Data",
      "description": "Schema and seed data"
    },
    {
      "id": "external",
      "name": "External",
      "description": "Outside this repo"
    }
  ],
  "components": [
    {
      "id": "owner-web",
      "name": "Owner & Pet Web",
      "layer": "entry",
      "kind": "module",
      "paths": [
        "src/main/java/org/springframework/samples/petclinic/owner/OwnerController.java",
        "src/main/java/org/springframework/samples/petclinic/owner/PetController.java",
        "src/main/java/org/springframework/samples/petclinic/owner/VisitController.java",
        "src/main/java/org/springframework/samples/petclinic/owner/PetValidator.java",
        "src/main/java/org/springframework/samples/petclinic/owner/PetTypeFormatter.java"
      ],
      "summary": "MVC controllers for finding/editing owners, adding pets and booking visits. Each handler re-loads the Owner through @ModelAttribute methods instead of using session state.",
      "responsibilities": [
        "Owner search with 5-per-page pagination",
        "Pet and visit forms with server-side validation",
        "Redirect-after-POST with flash messages"
      ],
      "tech": [
        "Spring MVC",
        "Bean Validation"
      ],
      "keyFiles": [
        {
          "path": "src/main/java/org/springframework/samples/petclinic/owner/OwnerController.java",
          "role": "Find, create, edit owners"
        },
        {
          "path": "src/main/java/org/springframework/samples/petclinic/owner/VisitController.java",
          "role": "Visit booking"
        }
      ],
      "interfaces": [
        {
          "kind": "http",
          "name": "/owners, /owners/{id}/pets, /owners/{id}/pets/{petId}/visits/new",
          "ref": "src/main/java/org/springframework/samples/petclinic/owner/OwnerController.java"
        }
      ],
      "snippets": [
        "visit-date-rule",
        "load-pet-with-visit",
        "owner-search"
      ],
      "risks": [],
      "confidence": "high",
      "evidence": [
        {
          "path": "src/main/java/org/springframework/samples/petclinic/owner/OwnerController.java",
          "line": 94
        }
      ]
    },
    {
      "id": "views",
      "name": "Thymeleaf Views",
      "layer": "entry",
      "kind": "ui",
      "paths": [
        "src/main/resources/templates",
        "src/main/scss",
        "src/main/resources/messages"
      ],
      "summary": "Server-rendered templates with shared layout fragments, SCSS compiled to petclinic.css, and message bundles for i18n.",
      "responsibilities": [
        "Page layout and fragments",
        "Form field fragments",
        "Localized messages"
      ],
      "tech": [
        "Thymeleaf",
        "Bootstrap (webjar)",
        "SCSS"
      ],
      "keyFiles": [
        {
          "path": "src/main/resources/templates/fragments/layout.html",
          "role": "Shared page layout"
        }
      ],
      "interfaces": [],
      "snippets": [],
      "risks": [],
      "confidence": "medium",
      "evidence": [
        {
          "path": "src/main/resources/templates/fragments/layout.html"
        }
      ]
    },
    {
      "id": "vets",
      "name": "Vets",
      "layer": "entry",
      "kind": "module",
      "paths": [
        "src/main/java/org/springframework/samples/petclinic/vet"
      ],
      "summary": "Read-only vet list as HTML and JSON. The repository is cached under 'vets', so data changes are invisible until the cache is evicted.",
      "responsibilities": [
        "List vets with specialties",
        "Serve /vets as JSON"
      ],
      "tech": [
        "Spring MVC",
        "Spring Data JPA",
        "JCache"
      ],
      "keyFiles": [
        {
          "path": "src/main/java/org/springframework/samples/petclinic/vet/VetController.java",
          "role": "HTML and JSON endpoints"
        },
        {
          "path": "src/main/java/org/springframework/samples/petclinic/vet/VetRepository.java",
          "role": "Cached queries"
        }
      ],
      "interfaces": [
        {
          "kind": "http",
          "name": "/vets.html, /vets",
          "ref": "src/main/java/org/springframework/samples/petclinic/vet/VetController.java"
        }
      ],
      "snippets": [
        "vets-cache"
      ],
      "risks": [],
      "confidence": "high",
      "evidence": [
        {
          "path": "src/main/java/org/springframework/samples/petclinic/vet/VetRepository.java",
          "line": 45
        }
      ]
    },
    {
      "id": "owner-domain",
      "name": "Owner Aggregate",
      "layer": "domain",
      "kind": "module",
      "paths": [
        "src/main/java/org/springframework/samples/petclinic/owner"
      ],
      "summary": "Owner, Pet, Visit and PetType entities plus OwnerRepository. Owner is the aggregate root: pets and visits are EAGER-fetched and cascaded, so saving an owner persists everything beneath it.",
      "responsibilities": [
        "Aggregate invariants (pet belongs to owner)",
        "Owner search by last-name prefix",
        "Persistence via a single repository"
      ],
      "tech": [
        "JPA",
        "Spring Data JPA"
      ],
      "keyFiles": [
        {
          "path": "src/main/java/org/springframework/samples/petclinic/owner/Owner.java",
          "role": "Aggregate root"
        },
        {
          "path": "src/main/java/org/springframework/samples/petclinic/owner/OwnerRepository.java",
          "role": "Only write path"
        }
      ],
      "interfaces": [],
      "snippets": [
        "owner-aggregate"
      ],
      "risks": [],
      "confidence": "high",
      "evidence": [
        {
          "path": "src/main/java/org/springframework/samples/petclinic/owner/Owner.java",
          "line": 67
        }
      ]
    },
    {
      "id": "base-model",
      "name": "Base Entities",
      "layer": "domain",
      "kind": "library",
      "paths": [
        "src/main/java/org/springframework/samples/petclinic/model"
      ],
      "summary": "@MappedSuperclass bases (BaseEntity id, NamedEntity, Person) shared by all entities.",
      "responsibilities": [
        "Identity",
        "Shared name/person fields"
      ],
      "tech": [
        "JPA"
      ],
      "keyFiles": [
        {
          "path": "src/main/java/org/springframework/samples/petclinic/model/BaseEntity.java",
          "role": "Id and isNew()"
        }
      ],
      "interfaces": [],
      "snippets": [],
      "risks": [],
      "confidence": "high",
      "evidence": [
        {
          "path": "src/main/java/org/springframework/samples/petclinic/model/BaseEntity.java",
          "line": 32
        }
      ]
    },
    {
      "id": "platform",
      "name": "Platform",
      "layer": "platform",
      "kind": "config",
      "paths": [
        "src/main/java/org/springframework/samples/petclinic/system",
        "src/main/java/org/springframework/samples/petclinic/PetClinicApplication.java",
        "src/main/java/org/springframework/samples/petclinic/PetClinicRuntimeHints.java",
        "src/main/resources/application.properties",
        "src/main/resources/application-mysql.properties",
        "src/main/resources/application-postgres.properties",
        "pom.xml",
        "build.gradle",
        "docker-compose.yml",
        "k8s"
      ],
      "summary": "Boot application, JCache 'vets' cache, locale switching, error/crash pages and native-image hints. The database is selected by Spring profile (h2 default, mysql, postgres).",
      "responsibilities": [
        "Bootstrapping and profiles",
        "Cache configuration",
        "Locale and error handling"
      ],
      "tech": [
        "Spring Boot",
        "Caffeine (JCache)",
        "Actuator"
      ],
      "keyFiles": [
        {
          "path": "src/main/java/org/springframework/samples/petclinic/system/CacheConfiguration.java",
          "role": "Declares the 'vets' cache"
        },
        {
          "path": "src/main/resources/application.properties",
          "role": "DB selection and JPA settings"
        }
      ],
      "interfaces": [],
      "snippets": [],
      "risks": [],
      "confidence": "high",
      "evidence": [
        {